Year,GMPP_ID,Project_Name,Department,Category,IPA_RAG,SRO_RAG,Risk_Label,Start_Date,End_Date,FY_Baseline_GBPm,FY_Forecast_GBPm,FY_Variance_Pct,WLC_Baseline_GBPm,Benefits_GBPm,Schedule_Narrative,Source_File,Classification_Method,End_Date_Parsed,Start_Date_Parsed,Slippage_Days,Delayed,Label_Method
2016,,Geological Disposal Facility Programme (GDF),BEIS,,Amber,,Medium Risk,30/06/2008,31/12/2040,28.47,28.53,0.0,11751.97,,"Planning schedules are in line with the ambition to identify a site and construct a GDF by the 2040s and are kept under review by the developer, Radioactive Waste Management Ltd.",Annual_Report_-_consolidated_data_and_narratives 2016.csv,"Keyword Match (pre-2018, no Category field)",2040-12-31,2008-06-30,3377.0,1.0,Schedule Slippage (>=2 valid annual observations)
2016,,Broadband Delivery Programme,DCMS,,Amber/Green,,Low Risk,06/12/2010,31/12/2020,456.1,437.8,-4.0,2223.9,,"The programme reached 90% superfast coverage in April 2016 and is on track to reach 95% superfast coverage by the end of 2017.  Coverage as at March 2017 reported by ThinkBroadband is 92.6%.

",Annual_Report_-_consolidated_data_and_narratives 2016.csv,"Keyword Match (pre-2018, no Category field)",2020-12-31,2010-12-06,1461.0,1.0,Schedule Slippage (>=2 valid annual observations)
2016,,Thames Estuary Asset Management Programme (TEAM2100),DEFRA,,Green,,Low Risk,01/04/2010,31/12/2025,23.4,20.3,-13.0,318.42,,Key milestones have been met and the project is on schedule to deliver by closure date.,Annual_Report_-_consolidated_data_and_narratives 2016.csv,"Keyword Match (pre-2018, no Category field)",2025-12-31,2010-04-01,0.0,0.0,Schedule Slippage (>=2 valid annual observations)
2016,,Thames Tideway Tunnel,DEFRA,,Amber/Green,,Low Risk,07/09/2010,31/12/2023,1.5,1.5,0.0,4159.8,,Project is on track to deliver to current timelines.,Annual_Report_-_consolidated_data_and_narratives 2016.csv,"Keyword Match (pre-2018, no Category field)",2023-12-31,2010-09-07,275.0,1.0,Schedule Slippage (>=2 valid annual observations)
2016,,Priority School Building Programme (PSBP),DFE,,Amber,,Medium Risk,19/07/2011,31/12/2075,745.07,724.07,-3.0,4403.01,,"Although there have been variations to the schedule of individual schemes within PSBP, the overall programme remains on track.
PSBP1 will deliver the majority of its schemes by Dec-17 as anticipated and PSBP2 although in the early stages does not at this point indicate any overall delays in delivery.",Annual_Report_-_consolidated_data_and_narratives 2016.csv,"Keyword Match (pre-2018, no Category field)",2075-12-31,2011-07-19,,,"Unresolved (single observation, Amber/Unknown RAG)"
2016,,Priority School Building Programme - Private Finance,DFE,,Amber/Green,,Low Risk,19/07/2011,01/07/2043,329.9,326.86,-1.0,2153.04,,No deviation from planned schedule,Annual_Report_-_consolidated_data_and_narratives 2016.csv,"Keyword Match (pre-2018, no Category field)",2043-07-01,2011-07-19,9466.0,1.0,Schedule Slippage (>=2 valid annual observations)
2016,,St Helena Airport,DFID,,Amber/Red,,High Risk,15/03/2005,31/08/2026,7.2,11.5,60.0,445.45,,"The construction of the airport was completed on schedule with the airport receiving certification during May 2016.  However, there has been a delay in starting commercial air services and aspects of the associated infrastructure are not complete",Annual_Report_-_consolidated_data_and_narratives 2016.csv,"Keyword Match (pre-2018, no Category field)",2026-08-31,2005-03-15,0.0,0.0,Schedule Slippage (>=2 valid annual observations)
2016,,A14 Cambridge to Huntingdon Improvement Scheme,DFT,,Amber,,Medium Risk,01/09/2012,30/09/2021,106.3,131.9,24.0,1492.3,,The project started construction works in Autumn 2016 as planned and the site compound opened in January 2017.  The scheme is also on track to be open for traffic by December 2020,Annual_Report_-_consolidated_data_and_narratives 2016.csv,"Keyword Match (pre-2018, no Category field)",2021-09-30,2012-09-01,567.0,1.0,Schedule Slippage (>=2 valid annual observations)
2016,,A303 Amesbury to Berwick Down,DFT,,Red,,High Risk,1/012/2014,01/06/2024,8.6,11.3,31.0,385.11,,"Project is on track with the option selection process prior to a statutory pre-application public consultation planned for January 2018 as part of the Development Consent Order Process. The Road Investment Strategy (RIS) has set a challenging target of starting works within the first RIS period, i.e. prior to April 2020. This target can only be achieved if the project is publicly financed.  A revised Private Finance delivery programme is being developed",Annual_Report_-_consolidated_data_and_narratives 2016.csv,"Keyword Match (pre-2018, no Category field)",2024-06-01,,3500.0,1.0,Schedule Slippage (>=2 valid annual observations)
2016,,Airport Capacity Programme,DFT,,Amber,,Medium Risk,01/07/2015,31/12/2029,14.0,9.0,-36.0,79.0,,"In October 2016 the Government announced its support for a new Northwest runway at Heathrow as its preferred scheme for delivering additional airport capacity in the South East. 
The end date of the programme has been amended to reflect the Airport Commissions assessment of need for new airport capacity by 2030. This is also in line with the draft Airports NPS published in February 2017 which refers to development anticipated to be required by 2030. If the NPS is designated, Heathrow Airport Limited have stated in their Statement of Principles (published in October 2016) that they expect to start operations in 2026 and this date may be revised as scheme planning progresses",Annual_Report_-_consolidated_data_and_narratives 2016.csv,"Keyword Match (pre-2018, no Category field)",2029-12-31,2015-07-01,0.0,0.0,Schedule Slippage (>=2 valid annual observations)
2016,,Crossrail Programme,DFT,,Amber/Green,,Low Risk,22/07/2008,31/12/2019,770.49,2167.2,181.0,14768.87,,"Crossrail Ltd report that the overall schedule and completion dates will be maintained. The Project Representative, who reports directly to the Department and Transport for London, provides ongoing assurance on the project schedule and will flag any potential deviation on the schedule to both Sponsors where corrective action can be taken. ",Annual_Report_-_consolidated_data_and_narratives 2016.csv,"Keyword Match (pre-2018, no Category field)",2019-12-31,2008-07-22,1230.0,1.0,Schedule Slippage (>=2 valid annual observations)
2016,,East West Rail Programme (Western Section),DFT,,Amber/Red,,High Risk,31/10/2012,31/03/2024,72.5,69.1,-4.0,1592.0,,"The overall schedule and completion dates will be maintained. Phase 1 was delivered on schedule in December 2016. We are looking at options to accelerate the delivery of the section between Bicester Village and Bletchley, and in parallel at potential synergies in the section where HS2 and East West Rail infrastructure works could impact each other. ",Annual_Report_-_consolidated_data_and_narratives 2016.csv,"Keyword Match (pre-2018, no Category field)",2024-03-31,2012-10-31,91.0,1.0,Schedule Slippage (>=2 valid annual observations)
2016,,High Speed Rail Programme (HS2),DFT,,Amber/Red,,High Risk,28/02/2011,31/12/2033,928.62,928.62,0.0,55700.0,,"The project continues to make excellent progress against a challenging schedule.  

Phase 1:

Royal Assent has been given to the Hybrid Bill which has given us powers to acquire land and construct the railway.  HS2 Ltd has been appointed nominated undertaker for the scheme. We have started to acquire land to commence construction, with around 500 notices for access being issued in March 2017 to carry out surveys, together with up to 50 temporary possession notices. The first compulsory purchase order notices were served in April.

Contracts have been let to undertake essential enabling works along the route, and we have started these works. The procurement process for main works contractors for the scheme has commenced and tender bids are being evaluated.  Award of contracts is expected in summer 2017, following completion of the procurement process.

We are also preparing to start the procurement of a Master Development Partner to create a scheme for the development of the wider Euston station area.

Phase 2 

Phase 2a Bill preparation is underway and the programme remains on track to deposit a hybrid Bill prior to summer recess in 2017. ",Annual_Report_-_consolidated_data_and_narratives 2016.csv,"Keyword Match (pre-2018, no Category field)",2033-12-31,2011-02-28,0.0,0.0,Schedule Slippage (>=2 valid annual observations)
2016,,Lower Thames Crossing Feasibility,DFT,,Amber/Red,,High Risk,30/05/2014,31/12/2026,35.6,26.62,-25.0,199.1,,"The project remains on target to achieve open for traffic by the end of 2025 if publicly financed. The Department for Transport is working with HM Treasury to assess the impact for private finance which, if used, could extend the overall programme by up to 2 years",Annual_Report_-_consolidated_data_and_narratives 2016.csv,"Keyword Match (pre-2018, no Category field)",2026-12-31,2014-05-30,0.0,0.0,Schedule Slippage (>=2 valid annual observations)
2016,,M20 Lorry Area,DFT,,Red,,High Risk,25/11/2015,20/01/2018,230.0,86.5,-62.0,250.0,,"The Project is currently subject to Judicial Challenge which was lodged in October 2016 and validated by court in November 2016. A hearing is scheduled for December 2017. 
Construction works were initially planned to start in October 2016, then delayed to December 2016 due to detail design delays. Since the Judicial challenge was lodged, the project team has been exploring means to increase the confidence in delivery of the project by working on an alternative design.",Annual_Report_-_consolidated_data_and_narratives 2016.csv,"Keyword Match (pre-2018, no Category field)",2018-01-20,2015-11-25,1988.0,1.0,Schedule Slippage (>=2 valid annual observations)
2016,,Rail Franchising Programme,DFT,,Amber,,Medium Risk,26/03/2013,29/11/2029,74.9,53.2,-29.0,7169.2,,"Proactive management of rail franchise schedule led to the most recent issue (Dec 16) with several competitions being retimed. The retiming serves to reduce the contract award congestion in 2018, de-conflict the franchise competitions to maximise commercial interest, optimising  market capacity , maintaining market confidence and ensuring Passenger Services are resourced to undertake multiple procurements.
The retiming of the InterCity West Coast competition (ICWC) (now the West Coast Partnership (WCP)), which will incorporate the procurement of a shadow operator for HS2 into the franchise competition and was announced in Nov 16. This retiming will allow us to continue to engage with the market on the best options for the franchise to do this. A West Coast Continuation project is now underway to ensure there is no gap in service between the ICWC expiry date (Apr 18) and the start of the new WCP franchise (Apr 19)
Also retimed were the South Western, South Eastern franchise and Great Western Franchise competitions. 
We currently have teams working on 5 live franchise competitions at various stages of completion.
",Annual_Report_-_consolidated_data_and_narratives 2016.csv,"Keyword Match (pre-2018, no Category field)",2029-11-29,2013-03-26,-1126.0,0.0,Schedule Slippage (>=2 valid annual observations)
2016,,Building Our Future Locations Programme,HMRC,,Amber/Red,,High Risk,05/01/2016,05/04/2021,310.2,340.7,10.0,2099.3,,Data not provided,Annual_Report_-_consolidated_data_and_narratives 2016.csv,"Keyword Match (pre-2018, no Category field)",2021-04-05,2016-01-05,1821.0,1.0,Schedule Slippage (>=2 valid annual observations)
2016,,Nuclear Warhead Capability Sustainment Programme,MOD,,Unknown,,,01/04/2008,30/04/2025,993.19,1026.97,3.0,20310.57,,"Exempt under Section 24 of Freedom of Information Act 2000 (National Security)

Exempt under Section 26 of Freedom of Information Act 2000 (Defence)",Annual_Report_-_consolidated_data_and_narratives 2016.csv,"Keyword Match (pre-2018, no Category field)",2025-04-30,2008-04-01,0.0,0.0,Schedule Slippage (>=2 valid annual observations)
2016,,North Wales Prison (NWP ) Programme,MOJ,,Amber,,Medium Risk,10/01/2013,31/05/2018,104.4,122.0,17.0,2252.7,,"The project remains on schedule. The first of 2,106 places opened on 27 February.",Annual_Report_-_consolidated_data_and_narratives 2016.csv,"Keyword Match (pre-2018, no Category field)",2018-05-31,2013-01-10,61.0,1.0,Schedule Slippage (>=2 valid annual observations)
2016,,Prison Estate Transformation Programme (PETP),MOJ,,Amber,,Medium Risk,01/04/2016,31/12/2021,0.0,0.0,,0.0,,The programme is on track as planned.,Annual_Report_-_consolidated_data_and_narratives 2016.csv,"Keyword Match (pre-2018, no Category field)",2021-12-31,2016-04-01,1588.0,1.0,Schedule Slippage (>=2 valid annual observations)
2018,,Geological Disposal Facility Programme (GDF),BEIS,Infrastructure and Construction,Amber,,Medium Risk,30/06/2008,31/12/2040,40.27,37.4,-7.0,12343.96,,"Planning schedules are in line with the ambition to identify a site and construct a GDF by the 2040s and are kept under review by the developer, Radioactive Waste Management Ltd.",Annual_Report_on_Major_Projects_2018_consolidated_data_and_narratives.csv,Official Category,2040-12-31,2008-06-30,3377.0,1.0,Schedule Slippage (>=2 valid annual observations)
2018,,Heat Networks Investment Project,BEIS,Infrastructure and Construction,Amber,,Medium Risk,25/11/2015,31/03/2021,10.4,7.89,-24.0,371.8,,Round One Assessment and Funding Decisions have been delayed by 2 months to the end of June to provide sufficient time to ensure adequate assessment processes and systems will be in place.,Annual_Report_on_Major_Projects_2018_consolidated_data_and_narratives.csv,Official Category,2021-03-31,2015-11-25,365.0,1.0,Schedule Slippage (>=2 valid annual observations)
2018,,Magnox & RSRL PBO Competition,BEIS,Infrastructure and Construction,Amber,,Medium Risk,03/04/2012,31/08/2019,490.0,532.0,9.0,2782.0,,"The contract will terminate on the 31st August 2019 in line with the project plan. At the time of this report, 44 of the 49 milestones are forecast to be delivered by the end of the contract with the other 5 partially delivered.",Annual_Report_on_Major_Projects_2018_consolidated_data_and_narratives.csv,Official Category,2019-08-31,2012-04-03,,,"Unresolved (single observation, Amber/Unknown RAG)"
2018,,New Polar Research Vessel,BEIS,Infrastructure and Construction,Amber,,Medium Risk,01/05/2014,31/12/2022,113.0,111.0,-2.0,1403.0,,Programme remains on schedule to end in 2022.,Annual_Report_on_Major_Projects_2018_consolidated_data_and_narratives.csv,Official Category,2022-12-31,2014-05-01,0.0,0.0,Schedule Slippage (>=2 valid annual observations)
2018,,Smart Metering Implementation Programme,BEIS,Infrastructure and Construction,Amber/Red,,High Risk,02/12/2009,31/12/2020,1060.97,1064.04,0.0,17215.78,,On schedule to meet the manifesto commitment for every home and small business to be offered a Smart Meter by 2020.,Annual_Report_on_Major_Projects_2018_consolidated_data_and_narratives.csv,Official Category,2020-12-31,2009-12-02,3652.0,1.0,Schedule Slippage (>=2 valid annual observations)
2018,,5G Testbeds & Trials,DCMS,Infrastructure and Construction,Amber/Red,,High Risk,28/02/2017,31/03/2021,79.15,42.65,-46.0,217.05,,"The Programme expects to deliver in line with its current schedule. There have been slight initial delays due to later than expected release of 5G equipment in the marketplace, and complex programme setup.",Annual_Report_on_Major_Projects_2018_consolidated_data_and_narratives.csv,Official Category,2021-03-31,2017-02-28,730.0,1.0,Schedule Slippage (>=2 valid annual observations)
2018,,700 MHz Clearance Programme,DCMS,Infrastructure and Construction,Amber,,Medium Risk,13/01/2015,01/01/2022,164.3,87.1,-47.0,594.92,,Delivery remains on track. To clear the 700MHz band the programme will make changes to 95 main stations (and 126 relays) by spring 2021,Annual_Report_on_Major_Projects_2018_consolidated_data_and_narratives.csv,Official Category,2022-01-01,2015-01-13,0.0,0.0,Schedule Slippage (>=2 valid annual observations)
2018,,Blythe House Programme,DCMS,Infrastructure and Construction,Amber,,Medium Risk,25/11/2015,31/03/2023,88.75,23.5,-74.0,338.0,,"The construction of new storage facilities and preparation for the removal of collections from Blythe House are on track, with the Science Museum Group, British Museum and V&A all receiving Treasury approval for their projects' Full Business Cases by Q1 of 2019/20. ",Annual_Report_on_Major_Projects_2018_consolidated_data_and_narratives.csv,Official Category,2023-03-31,2015-11-25,455.0,1.0,Schedule Slippage (>=2 valid annual observations)
2018,,Local Full Fibre Networks,DCMS,Infrastructure and Construction,Amber/Green,,Low Risk,01/04/2017,01/12/2021,50.7,58.0,14.0,318.7,,"Delivery remains on track. The objectives for the year remain ambitious however with robust planning, the Programme expect to deliver to cost and time. ",Annual_Report_on_Major_Projects_2018_consolidated_data_and_narratives.csv,Official Category,2021-12-01,2017-04-01,30.0,1.0,Schedule Slippage (>=2 valid annual observations)
2018,,Priority School Building Programme 2,DFE,Infrastructure and Construction,Amber/Red,,High Risk,01/05/2014,31/12/2022,448.6,448.6,0.0,2398.5,,Public School Building Programme 2 does not at this point have any indication that there will be any delays in in the overall delivery of the programme.,Annual_Report_on_Major_Projects_2018_consolidated_data_and_narratives.csv,Official Category,2022-12-31,2014-05-01,1427.0,1.0,Schedule Slippage (>=2 valid annual observations)
2018,,St Helena Airport,DFID,Infrastructure and Construction,Amber,,Medium Risk,15/03/2005,31/08/2026,4.0,4.64,16.0,445.1,,"The construction of the airport was completed on schedule with the airport receiving certification during May 2016.  The St Helena air service has made a strong start since commencing on 14 October 2017.  The service operates on a commercial basis with tickets sold on the global distribution system. The air service has exceeded initial operational and commercial expectations and is on course to make a small profit in its first year. However, aspects of the associated infrastructure are not yet complete.",Annual_Report_on_Major_Projects_2018_consolidated_data_and_narratives.csv,Official Category,2026-08-31,2005-03-15,0.0,0.0,Schedule Slippage (>=2 valid annual observations)
2018,,A14 Cambridge to Huntingdon Improvement Scheme,DFT,Infrastructure and Construction,Amber/Green,,Low Risk,01/09/2012,30/09/2021,407.3,475.0,17.0,1435.3,,"The project is on track to achieve the December 2020 Open for Traffic date, but with an aspiration to deliver earlier. The project end date in 30 September 2021 is also on track and reflects the time finalise the transition to business as usual once the road is open.
* The end date for roads projects published here is the date on which the last work to support the scheme is completed. This is different from the Open for Traffic (OfT) date, which is the completion date for schemes usually discussed with Highways England and reported elsewhere. The OfT date is usually some months (or even years) earlier than the formal end date depending on the nature and complexity of the scheme.",Annual_Report_on_Major_Projects_2018_consolidated_data_and_narratives.csv,Official Category,2021-09-30,2012-09-01,567.0,1.0,Schedule Slippage (>=2 valid annual observations)
2018,,A303 Amesbury to Berwick Down,DFT,Infrastructure and Construction,Amber,,Medium Risk,01/12/2014,01/06/2028,22.9,33.19,45.0,1556.4,,"The project remains on track for Start of Works in 2021 and Open for Traffic in 2026. The project end date is 2028 and reflects the time finalise the transition to business as usual once the road is open. In the last annual report the end date shown reflected the Open for Traffic date which has remained the same.
 * The end date for roads projects published here is the date on which the last work to support the scheme is completed. This is different from the Open for Traffic (OfT) date, which is the completion date for schemes usually discussed with Highways England and reported elsewhere. The OfT date is usually some months (or even years) earlier than the formal end date depending on the nature and complexity of the scheme.",Annual_Report_on_Major_Projects_2018_consolidated_data_and_narratives.csv,Official Category,2028-06-01,2014-12-01,3500.0,1.0,Schedule Slippage (>=2 valid annual observations)
2018,,A428 Black Cat to Caxton Gibbet,DFT,Infrastructure and Construction,Amber/Green,,Low Risk,01/04/2015,01/04/2025,14.3,8.3,-42.0,809.8,,"The project end date is in line with the public commitment to open for traffic during Roads Period 2.
* The end date for roads projects published here is the date on which the last work to support the scheme is completed. This is different from the Open for Traffic (OfT) date, which is the completion date for schemes usually discussed with Highways England and reported elsewhere. The OfT date is usually some months (or even years) earlier than the formal end date depending on the nature and complexity of the scheme.
",Annual_Report_on_Major_Projects_2018_consolidated_data_and_narratives.csv,Official Category,2025-04-01,2015-04-01,891.0,1.0,Schedule Slippage (>=2 valid annual observations)
2018,,Crossrail Programme,DFT,Infrastructure and Construction,Red,,High Risk,22/07/2008,Not provided,466.75,1089.2,133.0,15474.61,,"In August 2018 Crossrail Limited (CRL), a wholly owned subsidiary of TfL, announced that the opening of the tunnel section through central London would be delayed from December 2018. A new Chairman and Chief Executive have since been appointed at Crossrail Limited. On 25 April 2019 CRL released a new plan to complete the outstanding works and bring the line between Paddington and Abbey Wood into passenger service at the earliest possible date. Due to ongoing uncertainties, CRL identified a six-month delivery window with a midpoint at the end of 2020, although stated that Bond Street is unlikely to open at this time. Further work is now underway to develop a robust opening plan for the full railway including all through services and an earlier introduction of services between Paddington and Reading (Stage 5A) from December 2019 to build up train reliability and mileage.",Annual_Report_on_Major_Projects_2018_consolidated_data_and_narratives.csv,Official Category,,2008-07-22,1230.0,1.0,Schedule Slippage (>=2 valid annual observations)
2018,,Digital Railway,DFT,Infrastructure and Construction,Amber,,Medium Risk,23/11/2016,01/04/2023,32.0,32.02,0.0,450.0,,The projects within this Portfolio are still set for completion by the Project End Date.,Annual_Report_on_Major_Projects_2018_consolidated_data_and_narratives.csv,Official Category,2023-04-01,2016-11-23,,,"Unresolved (single observation, Amber/Unknown RAG)"
2018,,East Coast Mainline Programme,DFT,Infrastructure and Construction,Amber/Green,,Low Risk,01/04/2014,01/12/2023,141.2,141.2,0.0,1040.37,,The access plan for the King's Cross remodelling project has been revised as a consequences of delays with the Thameslink Programme and the main blockade of the Station will now take place in early 2021 instead of early 2020. This means that the new timetable that will deliver the majority of the Programme's benefits is now expected to be introduced in December 2021. The Project End Date remains as December 2023.,Annual_Report_on_Major_Projects_2018_consolidated_data_and_narratives.csv,Official Category,2023-12-01,2014-04-01,366.0,1.0,Schedule Slippage (>=2 valid annual observations)
2018,,East West Rail Programme (Western Section),DFT,Infrastructure and Construction,Amber,,Medium Risk,30/11/2011,30/06/2024,89.7,89.7,0.0,1091.4,,"Phase 2 Western section is currently underway and is expected to be delivered in 2024. Plans are in place to manage the challenging timetable to work through the complex and critical HS2 interface milestones and decision points. The outline business case has now been approved by the DfT Board Investment and Commercial Committee (BICC), progressing the project from development phase through to delivery with a full business case decision and Transport and Works Act Order (TWAO) approval planned for Summer 2019.",Annual_Report_on_Major_Projects_2018_consolidated_data_and_narratives.csv,Official Category,2024-06-30,2011-11-30,91.0,1.0,Schedule Slippage (>=2 valid annual observations)
2018,,Great Western Route Modernisation,DFT,Infrastructure and Construction,Amber/Red,,High Risk,01/12/2011,31/12/2024,655.0,769.0,17.0,5001.0,,"The Great Western Route Modernisation programme has delivered electrification from Paddington to Bristol Parkway and Newbury by December 2018, Chippenham by April 2019 and will complete with electrification to Cardiff by November 2019. This will enable the introduction of the enhanced timetable in December 2019 to deliver significant journey time benefits via new trains and infrastructure. Electrification to Cardiff is expected to be completed by January 2020 and project end date by December 2024.",Annual_Report_on_Major_Projects_2018_consolidated_data_and_narratives.csv,Official Category,2024-12-31,2011-12-01,,1.0,"RAG Proxy (single valid observation, no slippage comparison possible)"
2018,,Heathrow Expansion Programme,DFT,Infrastructure and Construction,Amber,,Medium Risk,01/07/2015,31/12/2029,14.7,7.9,-46.0,22732.9,,"The end date of the programme reflects the need for additional airport capacity by 2030 and this is reflected in the Airports National Policy Statement (ANPS).
Heathrow Airport Limited (HAL) are aiming for the runway to become operational in 2026. The Government believes that the capacity is required by 2030.",Annual_Report_on_Major_Projects_2018_consolidated_data_and_narratives.csv,Official Category,2029-12-31,2015-07-01,,,"Unresolved (single observation, Amber/Unknown RAG)"
