Year,GMPP_ID,Project_Name,Department,Category,IPA_RAG,SRO_RAG,Risk_Label,Start_Date,End_Date,FY_Baseline_GBPm,FY_Forecast_GBPm,FY_Variance_Pct,WLC_Baseline_GBPm,Benefits_GBPm,Schedule_Narrative,Source_File,Classification_Method,End_Date_Parsed,Start_Date_Parsed,Slippage_Days,Delayed,Label_Method
2022,DFT_0046_2021-Q2,East West Rail Configuration State 1,DFT,Infrastructure and Construction,Amber,,Medium Risk,2011-11-30,2025-09-01,330.87,264.98,-20.0,1353.0,,"Compared to 2021-Q4, your project end-date remained scheduled to finish on 01 SEP 2025. This is primarily due to the following factors: Overall the schedule remains ambitious, but achievable. Good progress has been made against important infrastructure milestones, including at Bletchley Flyover and Winslow Station. There is now increasing focus on ensuring operational readiness, for entry into service by 2025. Timetable development and progression of the operating model are important areas for progression.",GMPP_Government_Major_Projects_Portofolio_AR_Data_March_2022.csv,Official Category,2025-09-01,2011-11-30,0.0,0.0,Schedule Slippage (>=2 valid annual observations)
2022,DFT_0052_2122-Q1,East West Rail Connection Stage 2 & 3,DFT,Infrastructure and Construction,Red,,High Risk,2014-08-01,"Early planning GMPP project 

(The project has not yet passed SOC, or its programme equivalent)",88.36,74.64,-15.0,,,"This project is still in the concept and design stage. There remains a degree of uncertainty around the overall project schedule, until further work has been completed to refine delivery options and the project's scope and a funding profile agreed with HMT. More detailed information will be provided in subsequent iterations of the IPA's annual report and via project led public engagement in due course.",GMPP_Government_Major_Projects_Portofolio_AR_Data_March_2022.csv,Official Category,,2014-08-01,0.0,0.0,Schedule Slippage (>=2 valid annual observations)
2022,HO_0016_1213-Q1,Emergency Services Mobile Communications Programme (ESMCP),HO,Infrastructure and Construction,Amber,,Medium Risk,2011-06-01,2026-12-31,1024.03,1024.03,0.0,12026.0,,"Compared to 2021-Q4, your project end-date increased from 19 NOV 2024  to 31 DEC 2026 . This is primarily due to the following factors: An update of the Integrated Programme Plan (referred to as version 5 / 6) will be developed through April 2022 following conclusion of the re-lotting activity. This will then go through Governance for any decisions impacting schedule, scope or cost culminating in a Major Projects Review Group during Summer / Autumn 2022.",GMPP_Government_Major_Projects_Portofolio_AR_Data_March_2022.csv,Official Category,2026-12-31,2011-06-01,2191.0,1.0,Schedule Slippage (>=2 valid annual observations)
2022,DFE_0015_2021-Q3,FE Capital Transformation,DFE,Infrastructure and Construction,Amber,,Medium Risk,2020-04-01,2025-06-30,43.0,43.0,43.0,43.0,,"Compared to 2021-Q4, your project end-date remained scheduled to finish on 30 JUN  2025  . This is primarily due to the following factors: All three phases of the programme delivery are launched and are being progressed in tandem. The first phase of the fund saw an initial £200 million allocated to all colleges so they could carry out urgent remedial work to refurbish their buildings.  Following this, in April 2021 an announcement was made to work in partnership with sixteen colleges with some of the poorest condition sites in the country to upgrade their sites and ensure they are excellent places to learn. Construction is under way at one of these projects - Stafford College - and others will soon be ready to begin works. Through the 3rd Phase of the programme 62 FE colleges across the country are to benefit from building and campus upgrades and transformation, helping to level up opportunities for more people. 78 projects will be supported in total to allow colleges to create great buildings and facilities for high-quality training so more people progress into rewarding jobs, and plugging plug skills gaps in local economies.",GMPP_Government_Major_Projects_Portofolio_AR_Data_March_2022.csv,Official Category,2025-06-30,2020-04-01,0.0,0.0,Schedule Slippage (>=2 valid annual observations)
2022,MHCLG_0008_2122-Q1,Freeports,DLUHC,Infrastructure and Construction,Amber,,Medium Risk,2019-02-08,2027-12-31,12.9,5.1,-60.0,225.0,,"Your programme end-date is 31 DEC 2027. This is primarily due to the following factors: The Freeports policy is complex and diverse with may technical aspects that need to be addressed prior to a site becoming operational. In March 2021, the Chancellor announced 8 successful prospective Freeports locations in England, as selected following the fair, open and assessment process outlined in the Bidding Prospectus. The 8 English Freeports are progressing through the appraisal stage and are due to move in to the delivery phase of the project during the summer of 2022.",GMPP_Government_Major_Projects_Portofolio_AR_Data_March_2022.csv,Official Category,2027-12-31,2019-02-08,0.0,0.0,Schedule Slippage (>=2 valid annual observations)
2022,DFT_0039_2122-Q3,Further Electrification of Midland Main Line (MML3),DFT,Infrastructure and Construction,Unknown,Amber,,2022-01-21,2030-12-31,24.0,24.0,0.0,1468.0,,"Your project end-date is 31 DEC 2030. This is primarily due to the following factors: The completion of the electrification of the remainder of the MML route is achievable by the end of 2030 assuming funding is made available post the current spending revew settlement period. The first stage, the electrification to Sth Wigston, is planned to be  competed by the end of 2024. This is consistemt with the posistion set out in the IRP.",GMPP_Government_Major_Projects_Portofolio_AR_Data_March_2022.csv,Official Category,2030-12-31,2022-01-21,-731.0,0.0,Schedule Slippage (>=2 valid annual observations)
2022,MOD_0129_2122-Q1,Future Defence Infrastucture Services (FDIS),MOD,Infrastructure and Construction,Unknown,Green,,2016-06-07,2023-05-31,43.0,43.0,43.0,43.0,,"Compared to 2021-Q4, the project end-date remained scheduled to finish on 31 May 2023. 

",GMPP_Government_Major_Projects_Portofolio_AR_Data_March_2022.csv,Official Category,2023-05-31,2016-06-07,,,"Unresolved (single observation, Amber/Unknown RAG)"
2022,MOJ_0043_1920-Q2,Glen Parva New Build Prison,MOJ,Infrastructure and Construction,Amber,,Medium Risk,2019-01-31,2023-11-05,195.18,178.78,-8.0,6765.0,,"Compared to 20/21 Q4, the project end date has remained static. ",GMPP_Government_Major_Projects_Portofolio_AR_Data_March_2022.csv,Official Category,2023-11-05,2019-01-31,0.0,0.0,Schedule Slippage (>=2 valid annual observations)
2022,DECC_0005_1112-Q1,Geological Disposal Facility Programme (GDF),BEIS,Infrastructure and Construction,Unknown,Amber,,2008-06-30,2040-12-31,52.03,43.17,-17.0,20300.0,,"Compared to 2021-Q4, your project end-date remained scheduled to finish on 31 DEC  2040  . This is primarily due to the following factors: Significant progress has been made during the financial year even with the ongoing constraints of CoVID and the associated impact for community engagement.  However, many work-arounds have been effective in continuing engagement, noting that the communities set the pace for their own progress through the 'willing community' process.  3 community partnerships and now been formed and a fourth working group is preparing for Community Partnership formation and initial community investment grants have been approved.  Work continues to progress on potential additional community working groups in particular for targeted community lead generation.  The detailed preparations are underway for starting the first seismic surveys - Copeland summer 2022.  The detailed planning and procurement processes are underway for the formal site evaluation of all current sites.   The schedule remains on target for the first key decision point - site down selection in 25/26.",GMPP_Government_Major_Projects_Portofolio_AR_Data_March_2022.csv,Official Category,2040-12-31,2008-06-30,3377.0,1.0,Schedule Slippage (>=2 valid annual observations)
2022,MHCLG_0001_1920-Q3,Grenfell Site and Programme,DLUHC,Infrastructure and Construction,Amber,,Medium Risk,2019-07-15,2028-06-30,27.54,25.5,-7.0,157.0,,"Compared to 2021-Q4, your programme end-date increased from 30 APR 2026 to 30 JUN 2028. This is primarily due to the following factors: 
- The programme is engaging with bereaved, survivors and local residents on the future of the tower, following a decision by the Secretary of State to keep the tower standing for a further period.
- The Grenfell Tower Memorial Commission will determine the vision and scope of the memorial in 2022, this may impact the programme's schedule. The programme has developed an initial schedule for the memorial, using the Royal Institute of British Architects (RIBA) framework.",GMPP_Government_Major_Projects_Portofolio_AR_Data_March_2022.csv,Official Category,2028-06-30,2019-07-15,-307.0,0.0,Schedule Slippage (>=2 valid annual observations)
2022,BEIS_0001_1617-Q2,Heat Networks Investment Project,BEIS,Infrastructure and Construction,Unknown,Green,,2015-11-25,2022-03-31,62.3,119.1,92.0,376.0,,"Compared to 2021-Q4, your project end-date remained scheduled to finish on 31 MAR  2022  . This is primarily due to the following factors: HNIP is being delivered in two phases: the pilot scheme, which is complete, and the Main Scheme which closed to applicants in November 21.",GMPP_Government_Major_Projects_Portofolio_AR_Data_March_2022.csv,Official Category,2022-03-31,2015-11-25,365.0,1.0,Schedule Slippage (>=2 valid annual observations)
2022,MOJ_0045_1920-Q2,HMP Five Wells New Prison,MOJ,Infrastructure and Construction,Green,,Low Risk,2018-08-17,2022-07-31,34.7,63.46,83.0,5536.0,,"Compared to 2021-Q4, your project end-date increased from 14 JUN 2022  to 31 JUL 2022 . This is primarily due to the following factors: 
There was a 3 week 4 day delay to construction due to Covid-19 resulting in practical completion being achieved on 4 November 2021. Service commencement was delayed by the same amount of time, being achieved on 4 February 2022.",GMPP_Government_Major_Projects_Portofolio_AR_Data_March_2022.csv,Official Category,2022-07-31,2018-08-17,,0.0,"RAG Proxy (single valid observation, no slippage comparison possible)"
2022,MHCLG_0004_2021-Q4,Housing Infrastructure Fund,DLUHC,Infrastructure and Construction,Amber,,Medium Risk,2016-12-30,2028-03-31,901.5,393.3,-56.0,4334.0,,"Compared to 2021-Q4, your project end-date remained scheduled to finish on 31 MAR 2028. HIF is now in its delivery stage, with all remaining schemes contracted during 2021/22, over 90% of homes unlocked (i.e. with post-contract conditions sufficiently discharged to allow draw-down of funding to begin), and c.60 schemes on site. However, it is operating within an unprecedented and complex economic climate, taking into account impacts of the pandemic and wider inflationary pressures. HIF is facing cost and scheduling challenges which may extend the expected delivery timescales for some schemes. Work is taking place to understand and respond to these pressures, and the appropriate governance exists to support this work and ensure the programme remains able to deliver on its objectives.",GMPP_Government_Major_Projects_Portofolio_AR_Data_March_2022.csv,Official Category,2028-03-31,2016-12-30,0.0,0.0,Schedule Slippage (>=2 valid annual observations)
2022,DFT_0040_2021-Q1,HS2 Phase 1,DFT,Infrastructure and Construction,Amber,,Medium Risk,2009-01-14,2030-06-30,5060.1,5060.1,0.0,40295.0,,"Compared to 2021-Q4, your project end-date increased from 30 NOV 2029  to 30 JUN 2030. This is primarily due to the following factors: Compared to financial year 20/21-Q4, the project's end-date at 21/22-Q4 remains reported as 2030. This is the agreed Target Date, within the estimated opening range of 2029-2033. There has been some erosion of schedule float as a result of delays at the front end of the programme impacting on the start/ramp-up in Main Works activity, however HS2 Ltd continues to predict it can deliver to the Target Date.",GMPP_Government_Major_Projects_Portofolio_AR_Data_March_2022.csv,Official Category,2030-06-30,2009-01-14,,,"Unresolved (single observation, Amber/Unknown RAG)"
2022,DFT_0041_2021-Q1,HS2 Phase 2a,DFT,Infrastructure and Construction,Green,,Low Risk,2014-03-17,Exempt under Section 22 of the Freedom of Information Act 2000 (Information intended for future publication),363.9,363.9,0.0,22.0,,"The Phase 2a cost and schedule was formally approved in June 2021 with the revised schedule range of 2030-2034. The start of procurement for the main works civils framework is expected to commence later this year, which will provide the construction capacity to be managed by the DDP. Early environmental works and early civil works have also begun.",GMPP_Government_Major_Projects_Portofolio_AR_Data_March_2022.csv,Official Category,,2014-03-17,,1.0,RAG Proxy (no valid End_Date in any year)
2022,DFT_0042_2021-Q1,HS2 Phase 2b Western Leg,DFT,Infrastructure and Construction,Amber,,Medium Risk,2016-11-27,Exempt under Section 22 of the Freedom of Information Act 2000 (Information intended for future publication),216.8,216.8,0.0,22.0,," the Phase 2b Western Leg, following consideration and subsequent decision to take this forward separately from the previous Phase 2b project (which also covered the Eastern Leg). The estimated schedule range for the opening of the Phase 2b Western Leg is 2035 - 2041, as published in the update to the SOBC, published at Bill deposit in January 2022.",GMPP_Government_Major_Projects_Portofolio_AR_Data_March_2022.csv,Official Category,,2016-11-27,,,"Unresolved (no valid End_Date, Amber/Unknown RAG)"
2022,DCMS_0010_1718-Q3,Local Full Fibre Networks,DCMS,Infrastructure and Construction,Unknown,Green,,2017-04-01,2021-12-31,62.5,30.2,-52.0,308.0,,"Compared to 2021-Q4, your project end-date remained scheduled to finish on 31 DEC  2021  . This is primarily due to the following factors:",GMPP_Government_Major_Projects_Portofolio_AR_Data_March_2022.csv,Official Category,2021-12-31,2017-04-01,30.0,1.0,Schedule Slippage (>=2 valid annual observations)
2022,DEFRA_0010_2021-Q3,Leeds Phase 2 Flood Scheme,DEFRA,Infrastructure and Construction,Unknown,Amber,,2016-09-01,2024-10-18,32.97,27.0,-18.0,146.0,,"Compared to 2021-Q4, your project end-date remained scheduled to finish on 18 OCT  2024  . This is primarily due to the following factors: Unforeseen physical conditions have been encountered in the Step 2 area and while mitigation measures have been implemented, the construction works here have been delayed. These works are on the critical path and as such the project end date has moved out by approximately 8 weeks. The project has also been impacted by the extreme weather following the storms experienced late-February, the effects of which are currently being reviewed and assessed. The outcome of this assessment will be included in the next quarters submission and will also consider any further mitigation measures and opportunities to minimise programme impact. The overall design and construction works are approximately 50% through the programme.",GMPP_Government_Major_Projects_Portofolio_AR_Data_March_2022.csv,Official Category,2024-10-18,2016-09-01,0.0,0.0,Schedule Slippage (>=2 valid annual observations)
2022,MHCLG_0017_2122-Q2,Levelling Up Fund,DLUHC,Infrastructure and Construction,Amber,,Medium Risk,2021-03-03,2026-03-31,133.75,133.75,0.0,4800.0,,"Your programme end-date is 31 MAR 2026. This is primarily due to the following factors: Deliverability is a challenge requiring careful management, but the programme is broadly on schedule. Management of funding for Round 1 is underway, with the monitoring and evaluation strategy published, memorandums of understanding issued, first payments made and reporting due in in May, and further payments to follow. Round 2 was launched as planned alongside Spring Statement with improved guidance available to applicants through the prospectus, technical note and application form guidance, with webinars, Frequently asked questions and technical tutorials planned to follow shortly. The department are gearing up for the assessment of applications which will come in on 6 July 2022. An online digital application system will be used for Round 2 to improve the user experience for places and also the assessing departments. That is on track to go live on 31 May 2022.",GMPP_Government_Major_Projects_Portofolio_AR_Data_March_2022.csv,Official Category,2026-03-31,2021-03-03,731.0,1.0,Schedule Slippage (>=2 valid annual observations)
2022,BEIS_0001_2122-Q2,Low Cost Nuclear Programme (Rolls Royce SMRs Challenge),BEIS,Infrastructure and Construction,Amber,,Medium Risk,2021-05-01,2025-03-31,8.0,16.4,0.0,468.0,,"Your project end-date is 31 MAR 2025. This is primarily due to the following factors: The overall timelines are driven by the desired outcome, of completion of Step 2 of GDA, which the project entered in March 2022.",GMPP_Government_Major_Projects_Portofolio_AR_Data_March_2022.csv,Official Category,2025-03-31,2021-05-01,0.0,0.0,Schedule Slippage (>=2 valid annual observations)
2022,DFT_0022_1415-Q4,Lower Thames Crossing,DFT,Infrastructure and Construction,Amber,,Medium Risk,2014-05-30,2029-05-31,295.0,150.7,-49.0,6752.0,,"Compared to 2021-Q4, your project end-date remained scheduled to finish on 31 MAY  2029  . This is primarily due to the following factors: This reflects the continued focus from National Highways on DCO re-submission and the National Highways Community Impacts Consultation in July 2021 where National Highways adjusted its scope for LTC to allow the full opportunity that the Thames Freeport enables to be realised, working closely with the Port of Tilbury and Thurrock Council. 

This requires a further round of public consultation on the LTC from 12 May - 20 June and National Highways plans to submit the application for a DCO later this year.",GMPP_Government_Major_Projects_Portofolio_AR_Data_March_2022.csv,Official Category,2029-05-31,2014-05-30,1318.0,1.0,Schedule Slippage (>=2 valid annual observations)
2022,DFT_0027_1617-Q1,Midland Main Line Programme,DFT,Infrastructure and Construction,Green,,Low Risk,2011-01-01,2024-12-31,53.0,85.0,60.0,1671.0,,"Compared to 2021-Q4, your project end-date remained scheduled to finish on 31 DEC  2024  . This is primarily due to the following factors: The majority of the works have completed on time. The remaining works remain on schedule for completion in December 2024.",GMPP_Government_Major_Projects_Portofolio_AR_Data_March_2022.csv,Official Category,2024-12-31,2011-01-01,0.0,0.0,Schedule Slippage (>=2 valid annual observations)
2022,DFT_0043_2021-Q2,Midlands Rail Hub,DFT,Infrastructure and Construction,Amber,,Medium Risk,2017-04-01,2033-06-30,9.26,1.43,-89.0,1563.0,,"Compared to 2021-Q4, your project end-date remained scheduled to finish on 30 JUN  2033  . This is primarily due to the following factors: The OBC for the programme will be delivered in October 2022. There is no reason to suggest that the entire programme cannot be delivered by June 2033.",GMPP_Government_Major_Projects_Portofolio_AR_Data_March_2022.csv,Official Category,2033-06-30,2017-04-01,-2741.0,0.0,Schedule Slippage (>=2 valid annual observations)
2022,DCMS_0018_2021-Q3,Natural History Museum at Harwell,DCMS,Infrastructure and Construction,Unknown,Exempt under Section 43 of the Freedom of Information Act 2000 (Commercial Interests) - Commercial interests.,,2019-05-15,2026-12-30,6.55,2.92,-55.0,182.0,,Exempt under Section 43 of the Freedom of Information Act 2000 (Commercial Interests) - Commercial interests.,GMPP_Government_Major_Projects_Portofolio_AR_Data_March_2022.csv,Official Category,2026-12-30,2019-05-15,0.0,0.0,Schedule Slippage (>=2 valid annual observations)
2022,DEFRA_0013_2021-Q4,Nature for Climate Fund,DEFRA,Infrastructure and Construction,Amber,,Medium Risk,2020-04-01,2025-03-31,108.65,108.65,0.0,763.0,,"Compared to 2021-Q4, your project end-date remained scheduled to finish on 31 MAR  2025  . This is primarily due to the following factors: The schedule of the programme positions the Nature for Climate Fund programme well for delivery against its ambitious targets. The NCF Tree Programme is now well into delivery phase, with?a range of initiatives delivering tree planting but there has also been significant work to establish programme structures that will support successful delivery in years 3-5.",GMPP_Government_Major_Projects_Portofolio_AR_Data_March_2022.csv,Official Category,2025-03-31,2020-04-01,0.0,0.0,Schedule Slippage (>=2 valid annual observations)
2022,FCO_0013_1920-Q3,New Beijing Embassy and Residence,FCDO,Infrastructure and Construction,Unknown,The project is not in a position to provide this information.,,The project is not in a position to provide this information.,The project is not in a position to provide this information.,,,,,,The project is not in a position to provide this information.,GMPP_Government_Major_Projects_Portofolio_AR_Data_March_2022.csv,Official Category,,,,1.0,"RAG Proxy (single valid observation, no slippage comparison possible)"
2022,DHSC_0066_2021-Q2,New Hospital Programme,DHSC,Infrastructure and Construction,Amber,,Medium Risk,2021-01-01,2030-12-31,,,,,,"Early planning GMPP project 

(The project has not yet passed SOC, or its programme equivalent)",GMPP_Government_Major_Projects_Portofolio_AR_Data_March_2022.csv,Official Category,2030-12-31,2021-01-01,0.0,0.0,Schedule Slippage (>=2 valid annual observations)
2022,BIS_0014_1415-Q3,New Polar Research Vessel,BEIS,Infrastructure and Construction,Unknown,Green,,2014-05-01,2022-12-31,38.0,38.0,0.0,1420.0,,"Compared to 2021-Q4, your project end-date remained scheduled to finish on 31 DEC  2022  . This is primarily due to the following factors: Programme is now into closure phase. and remains on track to close in 2023.",GMPP_Government_Major_Projects_Portofolio_AR_Data_March_2022.csv,Official Category,2022-12-31,2014-05-01,0.0,0.0,Schedule Slippage (>=2 valid annual observations)
2022,DEFRA_0014_2021-Q4,NO2 Programme,DEFRA,Infrastructure and Construction,Amber,,Medium Risk,2016-01-01,2027-12-31,44.8,43.8,-2.0,885.0,,"Compared to 2021-Q4, your project end-date remained scheduled to finish on 31 DEC  2027  . This is primarily due to the following factors: The NO2 programme is legally mandated to deliver compliance with NO2 legal limits in the shortest time possible. The programme team works with local authorities across England who have exceedances to develop and implement local NO2 reduction plans through a variety of interventions. Confidence in the launch and delivery of Clean Air Zones (CAZ) has increased following successful delivery of Bath and North East Somerset (BaNES), Birmingham and Portsmouth CAZs in 2021. In February 2022,  Ministers granted permission for Greater Manchester to pause implementation of their CAZ and submit revised plans by July 2022. The programme team continue to work with Greater Manchester to continue engagement and meet legal obligations. The operational service ownership of the CAZ service successfully transitioned from JAQU to DVLA in February 2022.",GMPP_Government_Major_Projects_Portofolio_AR_Data_March_2022.csv,Official Category,2027-12-31,2016-01-01,0.0,0.0,Schedule Slippage (>=2 valid annual observations)
2022,BEIS_0002_2122-Q2,NZHF,BEIS,Infrastructure and Construction,Amber,,Medium Risk,2020-11-18,2025-03-31,,,,242.0,,"Your project end-date is 31 MAR 2025. This is primarily due to the following factors: The project's end-date at 21/22-Q4 is schedule to finish on 31/03/2025. This is primarily due to the following factors. The project is on track to delivery all key milestones to launch the Net Zero Hydrogen Fund in April 2022. Strands 1 & 2 will open on the fund launch and aim to award funding by the 31/12/2022. Strands 3 & 4 will be launched in June 2022 and April 2023, respectively.",GMPP_Government_Major_Projects_Portofolio_AR_Data_March_2022.csv,Official Category,2025-03-31,2020-11-18,0.0,0.0,Schedule Slippage (>=2 valid annual observations)
2022,DEFRA_0011_2021-Q3,Oxford Flood Alleviation Scheme,DEFRA,Infrastructure and Construction,Unknown,Amber,,2014-04-02,2030-01-09,2.32,2.07,-11.0,205.0,,"Compared to 2021-Q4, your project end-date remained scheduled to finish on 09 JAN  2030  . This is primarily due to the following factors: The project remains on schedule to complete as per the stated programme. Whilst it has taken longer than anticipated to prepare the planning application submission we have mitigated the impact of this by reviewing our construction programme sequencing. The end date is driven by construction works which can only commence once Oxfordshire County Council have completed replacement of the A423 road bridge. Any delays to their programme will have a consequential impact on the Oxford Flood Alleviation Scheme programme.",GMPP_Government_Major_Projects_Portofolio_AR_Data_March_2022.csv,Official Category,2030-01-09,2014-04-02,0.0,0.0,Schedule Slippage (>=2 valid annual observations)
2022,DOH_0017_1112-Q1,PHE Science Hub,DHSC,Infrastructure and Construction,Red,,High Risk,2013-06-28,2025-06-30,309.02,284.39,-8.0,2656.0,,"Compared to 2021-Q4, your project end-date remained scheduled to finish on 30 JUN  2025  . This is primarily due to the following factors: The programme end date will move to beyond 2031/2032.  The actual forecast end-date will be clearer with programme business case approval for funding for future years.  A variety of factors have caused the schedule to extend including: delay in programme funding approvals; COVID and the transition to UKHSA; significant changes to capital profile post SR21.",GMPP_Government_Major_Projects_Portofolio_AR_Data_March_2022.csv,Official Category,2025-06-30,2013-06-28,3580.0,1.0,Schedule Slippage (>=2 valid annual observations)
